{
  "type": "object",
  "properties": {
    "schema": {
      "const": "ukai.event/1"
    },
    "attempt_id": {
      "type": "string",
      "pattern": "^att_[0-9a-f]{8}-[0-9a-f]{4}-4[0-9a-f]{3}-[89ab][0-9a-f]{3}-[0-9a-f]{12}$"
    },
    "source": {
      "enum": [
        "wrapper",
        "audit",
        "proxy"
      ]
    },
    "source_seq": {
      "type": "integer",
      "minimum": 1,
      "maximum": 9007199254740991
    },
    "observed_at": {
      "type": "string",
      "format": "date-time"
    },
    "monotonic_ns": {
      "type": "string",
      "pattern": "^(0|[1-9][0-9]*)$"
    },
    "operation": {
      "enum": [
        "proc.exec",
        "proc.exit",
        "fs.create",
        "fs.write",
        "fs.rename",
        "fs.unlink",
        "fs.deny",
        "net.connect",
        "net.dns",
        "limit.hit",
        "jail.receipt",
        "intent.admitted",
        "intent.denied",
        "intent.settled",
        "note"
      ]
    },
    "stage": {
      "enum": [
        "attempt",
        "result"
      ]
    },
    "decision": {
      "enum": [
        "allow",
        "deny",
        null
      ]
    },
    "outcome": {
      "anyOf": [
        {
          "$ref": "#/$defs/outcome"
        },
        {
          "type": "null"
        }
      ]
    },
    "fields": {
      "type": "object",
      "maxProperties": 64,
      "propertyNames": {
        "not": {
          "enum": [
            "raw_argv",
            "raw_environment",
            "credential_contents"
          ]
        }
      }
    }
  },
  "required": [
    "schema",
    "attempt_id",
    "source",
    "source_seq",
    "observed_at",
    "monotonic_ns",
    "operation",
    "stage",
    "decision",
    "outcome",
    "fields"
  ],
  "additionalProperties": false,
  "$schema": "https://json-schema.org/draft/2020-12/schema",
  "$id": "urn:ukai:schema:event:1",
  "title": "Ukai source event v1",
  "description": "Frozen at jail milestone 1 (jail-v1 \u00a713, \u00a717). The shared envelope and the meaning of the audit and proxy sources; jail-event.schema.json restricts it to what the jail writes. Stream rules (source_seq, one attempt, receipt-note order) and native byte strings are ukai_jail::records::semantic and validate_contract.py over fixtures/semantic-cases.json.",
  "allOf": [
    {
      "if": {
        "properties": {
          "stage": {
            "const": "attempt"
          }
        },
        "required": [
          "stage"
        ]
      },
      "then": {
        "properties": {
          "outcome": {
            "type": "null"
          }
        }
      }
    },
    {
      "if": {
        "properties": {
          "stage": {
            "const": "result"
          }
        },
        "required": [
          "stage"
        ]
      },
      "then": {
        "properties": {
          "outcome": {
            "$ref": "#/$defs/outcome"
          }
        }
      }
    },
    {
      "if": {
        "properties": {
          "source": {
            "const": "audit"
          }
        },
        "required": [
          "source"
        ]
      },
      "then": {
        "properties": {
          "operation": {
            "enum": [
              "proc.exec",
              "proc.exit",
              "fs.create",
              "fs.write",
              "fs.rename",
              "fs.unlink",
              "fs.deny",
              "net.connect"
            ]
          },
          "decision": {
            "type": "null"
          }
        }
      }
    },
    {
      "if": {
        "properties": {
          "source": {
            "const": "proxy"
          }
        },
        "required": [
          "source"
        ]
      },
      "then": {
        "properties": {
          "operation": {
            "enum": [
              "net.connect",
              "net.dns"
            ]
          }
        }
      }
    },
    {
      "if": {
        "properties": {
          "operation": {
            "const": "fs.deny"
          }
        },
        "required": [
          "operation"
        ]
      },
      "then": {
        "properties": {
          "stage": {
            "const": "result"
          },
          "outcome": {
            "properties": {
              "ok": {
                "const": false
              },
              "errno": {
                "type": "string",
                "minLength": 1
              }
            },
            "required": [
              "ok",
              "errno"
            ]
          },
          "fields": {
            "properties": {
              "attempted_operation": {
                "enum": [
                  "proc.exec",
                  "fs.create",
                  "fs.write",
                  "fs.rename",
                  "fs.unlink",
                  "net.connect"
                ]
              }
            },
            "required": [
              "attempted_operation"
            ]
          }
        }
      }
    },
    {
      "$comment": "jail-v1.md:1808-1813 (\u00a713.1) and O01: an audit result's outcome is ok, return_value, errno and a syscall-side completion kind; proxy counters are proxy-only, so no audit event asserts bytes written.",
      "if": {
        "properties": {
          "source": {
            "const": "audit"
          },
          "stage": {
            "const": "result"
          }
        },
        "required": [
          "source",
          "stage"
        ]
      },
      "then": {
        "properties": {
          "outcome": {
            "required": [
              "return_value",
              "errno"
            ],
            "properties": {
              "completion": {
                "enum": [
                  "syscall_return",
                  "exec_transition",
                  "process_exit"
                ]
              }
            },
            "not": {
              "anyOf": [
                {
                  "required": [
                    "bytes_in"
                  ]
                },
                {
                  "required": [
                    "bytes_out"
                  ]
                },
                {
                  "required": [
                    "duration_ms"
                  ]
                }
              ]
            }
          }
        }
      }
    },
    {
      "$comment": "jail-v1.md:1809-1810 (\u00a713.1), :1421 and :1446-1448 (\u00a711.2): an exec transition is a confirmed new image: only proc.exec has one, and it is a success without an errno.",
      "if": {
        "properties": {
          "outcome": {
            "type": "object",
            "properties": {
              "completion": {
                "const": "exec_transition"
              }
            },
            "required": [
              "completion"
            ]
          }
        },
        "required": [
          "outcome"
        ]
      },
      "then": {
        "properties": {
          "operation": {
            "const": "proc.exec"
          },
          "outcome": {
            "properties": {
              "ok": {
                "const": true
              },
              "errno": {
                "type": "null"
              }
            }
          }
        }
      }
    },
    {
      "$comment": "jail-v1.md:1421 (\u00a711.2): never infer exec success from an entry; a successful proc.exec is the confirmed transition, never a syscall return.",
      "if": {
        "properties": {
          "source": {
            "const": "audit"
          },
          "operation": {
            "const": "proc.exec"
          },
          "outcome": {
            "type": "object",
            "properties": {
              "ok": {
                "const": true
              }
            },
            "required": [
              "ok"
            ]
          }
        },
        "required": [
          "operation",
          "outcome",
          "source"
        ]
      },
      "then": {
        "properties": {
          "outcome": {
            "properties": {
              "completion": {
                "const": "exec_transition"
              }
            }
          }
        }
      }
    },
    {
      "$comment": "jail-v1.md:1422 (\u00a711.2) and :1454-1455 (\u00a711.4): process_exit is the final thread-group death, which only proc.exit reports.",
      "if": {
        "properties": {
          "outcome": {
            "type": "object",
            "properties": {
              "completion": {
                "const": "process_exit"
              }
            },
            "required": [
              "completion"
            ]
          }
        },
        "required": [
          "outcome"
        ]
      },
      "then": {
        "properties": {
          "operation": {
            "const": "proc.exit"
          }
        }
      }
    },
    {
      "$comment": "jail-v1.md:1422 (\u00a711.2): an audit proc.exit result is a process exit, not a syscall return.",
      "if": {
        "properties": {
          "source": {
            "const": "audit"
          },
          "operation": {
            "const": "proc.exit"
          },
          "stage": {
            "const": "result"
          }
        },
        "required": [
          "operation",
          "source",
          "stage"
        ]
      },
      "then": {
        "properties": {
          "outcome": {
            "properties": {
              "completion": {
                "const": "process_exit"
              }
            }
          }
        }
      }
    },
    {
      "$comment": "jail-v1.md:1445 (\u00a711.2) and :1808 (\u00a713.1): a syscall return states its raw return and its errno, and a success has no errno while a failure names one. The sign of the raw return is the Linux convention and is in jail-event.schema.json (\u00a713.2:1901-1903).",
      "if": {
        "properties": {
          "outcome": {
            "type": "object",
            "properties": {
              "completion": {
                "const": "syscall_return"
              }
            },
            "required": [
              "completion"
            ]
          }
        },
        "required": [
          "outcome"
        ]
      },
      "then": {
        "properties": {
          "outcome": {
            "required": [
              "return_value",
              "errno"
            ],
            "properties": {
              "ok": {
                "type": "boolean"
              },
              "return_value": {
                "type": "integer"
              }
            },
            "allOf": [
              {
                "if": {
                  "properties": {
                    "ok": {
                      "const": true
                    }
                  },
                  "required": [
                    "ok"
                  ]
                },
                "then": {
                  "properties": {
                    "errno": {
                      "type": "null"
                    }
                  }
                }
              },
              {
                "if": {
                  "properties": {
                    "ok": {
                      "const": false
                    }
                  },
                  "required": [
                    "ok"
                  ]
                },
                "then": {
                  "properties": {
                    "errno": {
                      "type": "string",
                      "minLength": 1
                    }
                  }
                }
              }
            ]
          }
        }
      }
    },
    {
      "$comment": "jail-v1.md:1432-1436 (\u00a711.2): attempted_operation is the classification field of an fs.deny result and of nothing else.",
      "if": {
        "properties": {
          "source": {
            "const": "audit"
          },
          "operation": {
            "not": {
              "const": "fs.deny"
            }
          }
        },
        "required": [
          "operation",
          "source"
        ]
      },
      "then": {
        "properties": {
          "fields": {
            "not": {
              "required": [
                "attempted_operation"
              ]
            }
          }
        }
      }
    },
    {
      "$comment": "jail-v1.md:1811-1813 (\u00a713.1): a proxy connect result describes connect status, counters and duration, closed by the proxy.",
      "if": {
        "properties": {
          "source": {
            "const": "proxy"
          },
          "operation": {
            "const": "net.connect"
          },
          "stage": {
            "const": "result"
          }
        },
        "required": [
          "operation",
          "source",
          "stage"
        ]
      },
      "then": {
        "properties": {
          "outcome": {
            "required": [
              "bytes_in",
              "bytes_out",
              "duration_ms"
            ],
            "properties": {
              "completion": {
                "const": "proxy_close"
              }
            }
          }
        }
      }
    },
    {
      "$comment": "jail-v1.md:1811-1813 (\u00a713.1): proxy counters and a proxy close belong to the proxy source; consumers must not equate proxy bytes with file bytes.",
      "if": {
        "properties": {
          "outcome": {
            "type": "object",
            "properties": {
              "completion": {
                "const": "proxy_close"
              }
            },
            "required": [
              "completion"
            ]
          }
        },
        "required": [
          "outcome"
        ]
      },
      "then": {
        "properties": {
          "source": {
            "const": "proxy"
          }
        }
      }
    }
  ],
  "$defs": {
    "outcome": {
      "type": "object",
      "properties": {
        "ok": {
          "anyOf": [
            {
              "type": "boolean"
            },
            {
              "type": "null"
            }
          ]
        },
        "return_value": {
          "anyOf": [
            {
              "type": "integer"
            },
            {
              "type": "null"
            }
          ]
        },
        "errno": {
          "anyOf": [
            {
              "type": "string"
            },
            {
              "type": "null"
            }
          ]
        },
        "completion": {
          "enum": [
            "syscall_return",
            "exec_transition",
            "process_exit",
            "proxy_close",
            "wrapper"
          ]
        },
        "bytes_in": {
          "type": "integer",
          "minimum": 0,
          "maximum": 9007199254740991
        },
        "bytes_out": {
          "type": "integer",
          "minimum": 0,
          "maximum": 9007199254740991
        },
        "duration_ms": {
          "type": "integer",
          "minimum": 0,
          "maximum": 9007199254740991
        }
      },
      "required": [
        "ok",
        "completion"
      ],
      "additionalProperties": false
    }
  }
}
